{
  "registryType": "masa-relation-registry",
  "registryVersion": "0.2.0",
  "masaVersion": "0.2.0",
  "namespace": "https://masa.sonicfield.org/vocab/0.2.0#",
  "relations": [
    { "id": "masa:derived-from", "category": "derivation", "acyclic": true, "inverse": "masa:derivation-of", "lineageDirection": "subject-is-descendant", "definition": "The subject was produced through an attributable operation using the object." },
    { "id": "masa:derivation-of", "category": "derivation", "acyclic": true, "inverse": "masa:derived-from", "lineageDirection": "object-is-descendant", "definition": "The subject is used as an attributable material ancestor of the object." },
    { "id": "masa:version-of", "category": "version", "acyclic": true, "lineageDirection": "subject-is-descendant", "definition": "The subject is a later version of the object." },
    { "id": "masa:revision-of", "category": "version", "acyclic": true, "lineageDirection": "subject-is-descendant", "definition": "The subject revises an account while preserving the earlier version." },
    { "id": "masa:part-of", "category": "structure", "acyclic": true, "inverse": "masa:has-part", "definition": "The subject is a bounded part of the object." },
    { "id": "masa:has-part", "category": "structure", "acyclic": true, "inverse": "masa:part-of", "definition": "The subject contains the object as an explicitly bounded part." },
    { "id": "masa:member-of", "category": "structure", "acyclic": false, "definition": "The subject participates in a collection or corpus." },
    { "id": "masa:captured-from", "category": "provenance", "acyclic": true, "lineageDirection": "subject-is-descendant", "definition": "The subject representation was captured from the object under a declared apparatus." },
    { "id": "masa:transduced-from", "category": "provenance", "acyclic": true, "lineageDirection": "subject-is-descendant", "definition": "The subject was produced through a declared transduction of the object." },
    { "id": "masa:measured-from", "category": "evidence", "acyclic": true, "definition": "The subject measurement used the object as evidence." },
    { "id": "masa:listened-as", "category": "listening", "acyclic": false, "definition": "The subject was approached as the object under a declared listening pass." },
    { "id": "masa:segmented-from", "category": "derivation", "acyclic": true, "lineageDirection": "subject-is-descendant", "definition": "The subject region or representation was segmented from the object." },
    { "id": "masa:isolated-from", "category": "derivation", "acyclic": true, "lineageDirection": "subject-is-descendant", "definition": "The subject was isolated from the object through a declared method." },
    { "id": "masa:granulated-from", "category": "derivation", "acyclic": true, "lineageDirection": "subject-is-descendant", "definition": "The subject texture or fragment set was produced by granulating the object under a declared grain scheme." },
    { "id": "masa:mixed-with", "category": "composition", "acyclic": false, "definition": "The subject and object participate in a declared mixture." },
    { "id": "masa:grafted-with", "category": "generation", "acyclic": false, "definition": "The subject combines lineage or conditioning from the object and other parents." },
    { "id": "masa:transformed-by", "category": "operation", "acyclic": false, "definition": "The subject was transformed by the object OperationReceipt." },
    { "id": "masa:generated-by", "category": "operation", "acyclic": false, "definition": "The subject was generated by the object OperationReceipt." },
    { "id": "masa:mapped-from", "category": "mapping", "acyclic": true, "lineageDirection": "subject-is-descendant", "definition": "The subject sonic control or render was mapped from the object observation or relation." },
    { "id": "masa:rendered-as", "category": "derivation", "acyclic": true, "lineageDirection": "object-is-descendant", "definition": "The subject was rendered as the object representation." },
    { "id": "masa:performed-as", "category": "performance", "acyclic": true, "lineageDirection": "object-is-descendant", "definition": "The subject process or score was performed as the object representation or event." },
    { "id": "masa:parent-of", "category": "lineage", "acyclic": true, "inverse": "masa:child-of", "lineageDirection": "object-is-descendant", "definition": "The subject is a declared causal parent of the object." },
    { "id": "masa:child-of", "category": "lineage", "acyclic": true, "inverse": "masa:parent-of", "lineageDirection": "subject-is-descendant", "definition": "The subject is a declared causal child of the object." },
    { "id": "masa:sibling-of", "category": "lineage", "acyclic": false, "symmetric": true, "definition": "The subject and object share declared parentage without implying perceptual identity." },
    { "id": "masa:variation-of", "category": "lineage", "acyclic": true, "lineageDirection": "subject-is-descendant", "definition": "The subject is an attributable variation of the object." },
    { "id": "masa:continuation-of", "category": "lineage", "acyclic": true, "lineageDirection": "subject-is-descendant", "definition": "The subject temporally continues the object from a declared boundary." },
    { "id": "masa:located-in", "category": "spatial", "acyclic": false, "definition": "The subject is situated in the object context or territory at a declared precision." },
    { "id": "masa:recorded-at", "category": "spatial", "acyclic": false, "definition": "The subject representation was recorded at the object place or context." },
    { "id": "masa:associated-with", "category": "association", "acyclic": false, "definition": "The subject has a declared non-equivalent association with the object." },
    { "id": "masa:attributed-to", "category": "responsibility", "acyclic": false, "definition": "The subject carries an attribution to the object Actor." },
    { "id": "masa:stewarded-by", "category": "responsibility", "acyclic": false, "definition": "The subject is stewarded under the responsibility of the object Actor." },
    { "id": "masa:governed-by", "category": "policy", "acyclic": false, "definition": "The subject is governed by the object Policy." },
    { "id": "masa:permitted-by", "category": "policy", "acyclic": false, "definition": "The subject operation or disclosure was permitted by the object policy evaluation." },
    { "id": "masa:withheld-by", "category": "policy", "acyclic": false, "definition": "The subject is withheld under the object Policy or Actor decision." },
    { "id": "masa:expired-by", "category": "policy", "acyclic": false, "definition": "The subject access or retention expired through the object policy event." },
    { "id": "masa:supports", "category": "epistemic", "acyclic": false, "definition": "The subject claim supplies evidence supporting the object claim." },
    { "id": "masa:contradicts", "category": "epistemic", "acyclic": false, "symmetric": true, "definition": "The subject and object make materially conflicting claims." },
    { "id": "masa:differs-from", "category": "epistemic", "acyclic": false, "symmetric": true, "definition": "The subject differs from the object without requiring contradiction." },
    { "id": "masa:incomparable-with", "category": "epistemic", "acyclic": false, "symmetric": true, "definition": "The current apparatus or terms do not authorize comparison between subject and object." },
    { "id": "masa:speculates-about", "category": "epistemic", "acyclic": false, "definition": "The subject is a declared speculative proposition about the object." }
  ]
}
